,IMAGE_URL_0,DESCRIPTION_0,SEECLICKFIX_DATE_0,IMAGE_URL_1,DESCRIPTION_1,SEECLICKFIX_DATE_1,IMAGE_URL_2,DESCRIPTION_2,SEECLICKFIX_DATE_2,IMAGE_URL_3,DESCRIPTION_3,SEECLICKFIX_DATE_3,IMAGE_URL_4,DESCRIPTION_4,SEECLICKFIX_DATE_4,IMAGE_URL_5,DESCRIPTION_5,SEECLICKFIX_DATE_5,OAK_311_DATE,LATITUDE,LONGITUDE
0,https://seeclickfix.com/files/issue_images/0013/9389/1374115823614.jpg,Overgrown and blocking side walk. ,2013-07-17T22:51:11-04:00,,"Many years ago, the City of Oakland staff planted a tree in front of my house. This tree is now swooping to one side and I am afraid that it will fall onto my car.  Also the roots of this tree have made the sidewalk in front of my house uneven. One side of the pavement is about 1.25 inches higher than the other.  One person has already tripped while walking in front of our house.  Can you remove the tree altogether?  Thank you.",2016-01-29T12:34:56-05:00,,,,,,,,,,,,,11/04/2017 03:30:20 PM,37.80309389,-122.24230119
1,https://seeclickfix.com/files/issue_images/0015/3815/IMG_3050.jpg,Trees on public sidewalk need to be trimmed.  They are hanging too low.,2013-09-18T14:55:11-04:00,https://seeclickfix.com/files/issue_images/0018/3623/1395324601897.jpg,Treedown at fourth and Alice,2014-03-20T10:10:48-04:00,https://seeclickfix.com/files/issue_images/0038/2325/1442265037649.jpg,Huge branch fallen down in street,2015-09-14T17:11:33-04:00,https://seeclickfix.com/files/issue_images/0040/5347/1447275193467.jpg,"Broken tree branch obstructing: parking, traffic lane and sidewalk. ",2015-11-11T15:55:10-05:00,https://seeclickfix.com/files/issue_images/0037/7954/1441385496308.jpg,Huge branch on sidewalk,2015-09-04T12:53:07-04:00,https://seeclickfix.com/files/issue_images/0040/5827/1447261492727.jpg,Branch broken,2015-11-12T19:21:18-05:00,11/06/2017 02:08:59 PM,37.79439274,-122.2719478
2,,Branches cut by city during Dec storms have been left sitting on the owner's property. ,2015-01-30T17:04:12-05:00,,,,,,,,,,,,,,,,05/18/2018 03:20:47 PM,37.7835821,-122.14179659
3,https://seeclickfix.com/files/issue_images/0015/1519/1378656882979.jpg,This tree needs to be replaced!,2013-09-08T12:15:58-04:00,https://seeclickfix.com/files/issue_images/0028/6688/IMG_4548.JPG,The residence located at 2247 E. 15th Street has trees growing from inside their property which over hang on to Munson Way and preventing cars from passing thru without causing the branches to make contact with the car. This is especially true with bigger vehicles & commercial. They do not have enough clearance to drive a vehicle thru safely without stricking the car. The home owners have improperly planted trees which are over grown & not being maintained. I believe this is a Municipal Code Violation which should be corrected with trees being removed due to being improperly planted or trimmed high enough for a normal clearance of a car or commercial truck being able to pass thru safely.,2015-02-08T19:01:39-05:00,,,,,,,,,,,,,11/08/2018 02:29:43 PM,37.78571941,-122.23416308
4,https://seeclickfix.com/files/issue_images/0030/9608/1428540255250.jpg,need some maintainance. ,2015-04-08T20:44:23-04:00,,hazardous tree at the residence:  3232 Elmwood Avenue. Tree well far beyond the sidewalk and the tree branches are so low and heavy you can't walk through the sidewalk.  Peoplel must walk around the sidewalk into the street to get by putting children at risk. ,2016-11-04T12:32:16-04:00,https://seeclickfix.com/files/issue_images/0022/9776/1407986293963.jpg,Large fallen tree branch (on my car - I was able to drive it away from the branch),2014-08-13T23:18:33-04:00,https://seeclickfix.com/files/issue_images/0022/9741/1407980737420.jpg,Tree fallen in street. Blocking Ford st 94601,2014-08-13T21:46:17-04:00,,"The palm tree in front of 614 Lancaster is full of dead leaves/branches and is a fire hazard. It needs to be trimmed asap. Pictures of the tree can be seen here: https://www.google.com/maps/place/3057+E+7th+St,+Oakland,+CA+94601/@37.7724298,-122.2295578,3a,75y,132.77h,103.29t/data=!3m7!1e1!3m5!1sIBRN4sazyZ0FwPuA_EG63w!2e0!6s%2F%2Fgeo2.ggpht.com%2Fcbk%3Fpanoid%3DIBRN4sazyZ0FwPuA_EG63w%26output%3Dthumbnail%26cb_client%3Dmaps_sv.tactile.gps%26thumb%3D2%26w%3D203%26h%3D100%26yaw%3D31.292292%26pitch%3D0%26thumbfov%3D100!7i13312!8i6656!4m5!3m4!1s0x808f868d37383801:0xedf176254a1c64ec!8m2!3d37.7725655!4d-122.2295961",2016-12-22T17:28:00-05:00,,,,10/14/2017 02:21:30 PM,37.77205607,-122.22982612
5,https://seeclickfix.com/files/issue_images/0016/5217/1385222093522.jpg,Please come trim these trees they are too tall and will eventually fall on someone's house or on someone like it did on Austin Street. ,2013-11-23T10:57:46-05:00,https://seeclickfix.com/files/issue_images/0017/8572/1393182074942.jpg,Tree uprooted looks like it was hit by a car. Fruitvale and Foothill. ,2014-02-23T14:03:37-05:00,https://seeclickfix.com/files/issue_images/0016/5218/1385222314241.jpg,Please come trim the trees in the creek tree fell so close to neighbors house. It's better to trim them before it becomes an emergency and someone sues.,2013-11-23T10:59:48-05:00,,Overgrown creek area with dumping of trash causing rats and mice infestation in area,2014-10-03T18:35:44-04:00,https://seeclickfix.com/files/issue_images/0034/2617/1434996028477.jpg,County eucalyptus trees overhanging private property/houses with many children present! Please help!,2015-06-22T14:01:52-04:00,https://seeclickfix.com/files/issue_images/0088/2134/img-SCF__20170925_184750-1778273664-772899708.jpeg,The tree canopy is too low.  It has attracted illegal activity. Please trim the tree up. ,2017-09-25T22:12:12-04:00,11/26/2018 05:18:44 PM,37.78651235,-122.2258572
6,,"On MacArthur in the westbound direction, a tree blocks the stop sign. At night, drivers cannot see the sign or paint on the road and run the intersection.  Please trim the tree.",2015-04-08T03:27:43-04:00,https://seeclickfix.com/files/issue_images/0025/5498/20140706_144514.jpg,No one has trimmed dis @#$% of tree yet! No one can see around dis @#$% to make da turn! On-comin' traffic will slam into ya! ,2014-11-05T12:21:40-05:00,https://seeclickfix.com/files/issue_images/0021/5953/20140706_144509.jpg, Untrimmed bottom foliage blocking driver's vision for turning at intersection. ,2014-07-08T02:16:59-04:00,https://seeclickfix.com/files/issue_images/0080/2094/1498151418966.jpg,Blocked sidewalk and low over head.,2017-06-22T13:11:43-04:00,,,,,,,04/26/2013 08:21:25 AM,37.77222138,-122.1730519
7,https://seeclickfix.com/files/issue_images/0023/6870/Verizon_Imports_349.jpg,"The landscaping along the East side of Pleasant Valley Ave between the Rockridge Shopping Center and Montgomery Street is in dire need of attention. The undergrowth and downfall represent a fire hazard, and debris is enroaching on the public sidewalk. The Eucalyptus trees need thinning; several major branches are precariously hanging over the roadway. ",2014-09-02T19:03:44-04:00,,,,,,,,,,,,,,,,06/08/2014 12:30:16 AM,37.83153588,-122.24889381
8,https://seeclickfix.com/files/issue_images/0030/1663/tia-519638297.jpg,downed tree from car crash,2015-03-20T18:57:38-04:00,,Tree down blocking rt lane east bound Keller ave ,2014-05-02T19:10:57-04:00,,"downed trees in median strip
this has occurred over time from accidents, the latest one last week. the trees have never been replaced. the median is now patchy with missing and dying trees. ",2014-07-25T16:05:27-04:00,,,,,,,,,,07/25/2014 01:10:15 PM,37.7727361,-122.14304459
9,https://seeclickfix.com/files/issue_images/0032/4264/1431450149764.jpg,Possible campfire in woods on south side 580 as per smokey smell while walking over ramp. Have OFD check out?,2015-05-12T13:02:57-04:00,https://seeclickfix.com/files/issue_images/0068/7599/1486861061423.jpg,Tree blocking pedestrian walkway on Lake Park near overpass. ,2017-02-11T19:58:24-05:00,https://seeclickfix.com/files/issue_images/0012/8972/weeds.jpg,"Poison Oak, ivy, and thorned vines are growing down from the lot on the hill have encroached onto the sidewalk below to the point that two people cannot pass through side-by-side, and someone in a wheelchair or a cart would have a hard time getting through. This lot belongs to the owners of the 555-561 Merritt Ave. complex above it.",2013-06-02T13:25:07-04:00,https://seeclickfix.com/files/issue_images/0008/4567/Tunnel_of_Darkness2.jpg,"Will post on Facebook for comment - PLEASE comment!  On the corner of Wesley and Hillgirt Circle, Oakland, is a section of overgrown bushes, aloes and small trees which has grown overarching the sidewalk (from street side) and into the sidewalk from the homeowner's fence, impeding visibility ESPECIALLY in the darkness.  It is a dangerous and unlighted section of sidewalk.  At least one person was attacked in this location (my daughter).  Passers by avoid this section of the block and for good reason, walking in the street instead which is not safe either.  The bushes are so thick that a person could step back into them and be completely concealed from view.  There is no streelight.  The homeowners have declined to maintain the area outside their fence.  As you can see from the photos, the area is very overgrown and impinging on the sidewalk.  Imagine the person in the photograph dressed in black, at night.  The Feet on the Street neighborhood lighting patrol group has observed this area; the entire neighborhood deems it to be unsafe; it was reported to public works last year by Hoang Banh, our Community Rep from OPD; neighbors on the Cleveland Heights Neighbors email group addressed the homeowners who have advised pedestrians ""cross the street and walk there"".  FOS members attempted to petition the city for a streelight (1.5 years ago) but funding ran out before the petition was processed.  Thank you for your attention.  UPDATE:  PARTIAL IMPROVEMENT BY HOMEOWNERS - THERE STILL NEEDS TO BE WORK DONE BY REMOVAL OF LARGE PINE TREES (NOT ALL PERHAPS EVERY OTHER ONE), ADDITIONAL STREET LIGHT, AND REMOVAL OF OVERGROWTH FROM YARD OVER SIDEWALK TO STREET.",2012-07-31T15:52:56-04:00,,,,,,,08/02/2014 04:54:46 PM,37.80613184,-122.24446294
10,https://seeclickfix.com/files/issue_images/0039/8810/1445714369643.jpg,Tree leaning and ready to fall on children on way to school,2015-10-24T15:19:46-04:00,https://seeclickfix.com/files/issue_images/0055/3613/1469028155360.jpg,This happens every year - the weeds and shrubs grow to a height that blocks driver visibility. Very dangerous for drivers turning onto Park who are unable to see the inevitable light runners. Please just Roundup this corner!,2016-07-20T11:24:23-04:00,,"Dangerous corner that is often under estimated.  When turning left onto Park Blvd, the trees and tall weeds block the view of oncoming traffic from up the hill. Although it is a traffic signal, people are always trying to run the light - Drivers moving into the intersection wont know this until it is too late.    *** Ongoing issue.  I reported this last year and it was fixed. The weeds and trees have all grown back ***",2014-08-23T17:45:43-04:00,https://seeclickfix.com/files/issue_images/0012/8624/overgrown-2013-0531.jpg,"There's a circle of trees (not a house lot) in the middle of Trafalgar Place, across from 2151, 2155, 2167 and 2173, which has become completely overgrown with ivy, Scotch broom, poison oak and other weeds.  There are also several dying trees in this circle, 2 of which have dropped large branches onto the road over the last few years and which hang on the telephone lines.  And there's a pile of garbage in the middle - boards, old tires, etc.  If the city would help clean up this area, my neighbors and I would be willing to maintain it, but right now it's so overgrown and full of poison oak that we can't even approach it.  It seems like a fire hazard, too.  Any help you can provide in cleaning it up or telling me which agency to work with on this issue would be greatly appreciated.",2013-05-31T16:01:40-04:00,https://seeclickfix.com/files/issue_images/0012/0408/1366950637066.jpg,"Dangerous corner that is often under estimated.  When turning left onto Park Blvd, the trees and tall weeds block the view of oncoming traffic from up the hill. Although it is a traffic signal, people are always trying to run the light - Drivers moving into the intersection wont know this until it is too late. ",2013-04-26T00:36:23-04:00,,,,08/27/2014 04:08:39 PM,37.82103852,-122.20772963
11,https://seeclickfix.com/files/issue_images/0036/5491/1439145867867.jpg,"Related to OPW Service Request #467585. The dead city tree was cut down by the city more than a year ago, but the large stump remains. Is there any plan to remove the stump? It may be termite-infested now, or at least I see a lot of burrowed holes in it.

I would like to be able to replace it with a new city-approved tree. I can plant and care for the new tree myself, but cannot do it with the stump. ",2015-08-09T14:45:17-04:00,https://seeclickfix.com/files/issue_images/0057/4249/1471471846842.jpg,Smashed tree needs to be removed and replaced on median on 51 street west of Desmond ,2016-08-17T18:14:02-04:00,https://seeclickfix.com/files/issue_images/0040/0674/1446173553929.jpg,"The sap from a city of Oakland tree, which is located in front of my house, is causing damage to my roof. The branches that hang over my roof need to be pruned.  It is also causing damage to the paint on my house.  My house is located at 318 49th Street.  ",2015-10-29T22:59:37-04:00,https://seeclickfix.com/files/issue_images/0035/4123/1437076386553.jpg,Construction crew remodeling house poured concrete in parkway strip completely choking the street tree,2015-07-16T15:53:28-04:00,https://seeclickfix.com/files/issue_images/0073/8394/1491957705854.jpg,Street tree and vegetation are overgrown and blocking sidewalk access,2017-04-14T15:16:33-04:00,https://seeclickfix.com/files/issue_images/0066/6883/1484178941305.jpg,Fell blocking sidewalk,2017-01-11T18:56:53-05:00,09/10/2014 04:31:30 PM,37.83443954,-122.25234417
12,https://seeclickfix.com/files/issue_images/0021/2327/1403902822752.jpg,Tree planted as part of PWA 66th Ave streetscape was recently damaged by car.,2014-06-27T17:01:31-04:00,https://seeclickfix.com/files/issue_images/0065/2314/20161212_150946.jpg,"There is two trees on Flora Ave. between 66th Ave and Havenscourt that need to be pruned/trimmed. They attract illegal dumping, reduce lighting and attract illegal activities.",2016-12-13T13:27:10-05:00,,,,,,,,,,,,,10/09/2014 10:34:41 AM,37.76214218,-122.19328856
13,,"On MacArthur in the westbound direction, a tree blocks the stop sign. At night, drivers cannot see the sign or paint on the road and run the intersection.  Please trim the tree.",2015-04-08T03:27:43-04:00,https://seeclickfix.com/files/issue_images/0025/5498/20140706_144514.jpg,No one has trimmed dis @#$% of tree yet! No one can see around dis @#$% to make da turn! On-comin' traffic will slam into ya! ,2014-11-05T12:21:40-05:00,https://seeclickfix.com/files/issue_images/0021/5953/20140706_144509.jpg, Untrimmed bottom foliage blocking driver's vision for turning at intersection. ,2014-07-08T02:16:59-04:00,https://seeclickfix.com/files/issue_images/0026/6040/20140706_144514.jpg,Unable to see around undergrowth of this tree in the median of Foothill Blvd! Turning from Foothill onto 69th Ave. is EXTREMELY dangerous as no one can see oncoming traffic! I have reported this before to no avail. It has only gotten worse!,2014-12-08T22:15:56-05:00,,,,,,,11/05/2014 09:30:27 AM,37.76962788,-122.17594163
14,,Dead 30 ft street tree. Ongoing water leak has killed the tree. The roots my be rotten and and the tree could become a hazard if bumped by a car or strong winds. The water leak has been reported many times over several years.,2015-04-04T14:28:35-04:00,,Dead tree in parking strip in front of Shell station.,2012-11-24T21:50:29-05:00,https://seeclickfix.com/files/issue_images/0052/5155/1465936647809.jpg,"Acacia branches hanging low, hits passing vehicles. Thanks, Noel Gallo's team",2016-06-14T16:38:23-04:00,,Broken branches on sidewalk ,2015-07-11T15:57:04-04:00,,Large truck load of trimmed branch's left in parking lot. Been there a while.,2015-07-15T16:43:28-04:00,,Large tree branch in street,2017-06-18T22:01:05-04:00,12/08/2014 06:40:17 PM,37.79951624,-122.21769926
15,,Another mud slide has happened at this intersection.  A lot of mud blocking is half of the road. There is tree that's down acrosse the road but it is  small and you can drive over it,2017-02-10T11:45:29-05:00,,"Tree fell in January, blocking pathway. Dangerous. Eyesore in area community is in process of rehabbing.",2016-02-20T17:59:21-05:00,,Tree/Landslide at the Chelton/Ascot intersection.,2017-01-20T09:57:16-05:00,https://seeclickfix.com/files/issue_images/0069/2896/1487452815236.jpg,Large eucalyptus tree down at Ascot and Chelton. It is lying across both lanes of traffic. This is not the same mudslide as the one 50 yards up on Ascot. This is a totally new tree and slide,2017-02-18T16:29:06-05:00,,"Several eucalyptus trees which fell earlier this winter are now hanging down the steep hill across from Montera Middle School on Scout, waiting to toboggan down on a passing car, as well as partially blocking the road.  Please remove these trees before someone gets hurt.  Thanks!",2017-02-23T19:10:10-05:00,,"there are 3 THREATENING eucalyptus tree that hover and lean over our house. sunday afternoon a large branch fell on my deck and just missed both my dog and myself. we were very lucky, could have been badly hurt or killed. (in the spring an inspector came by to look from the street and did not ring the bell, just left a door tag) 

there are many large dead branches looming above that need to be seen from our deck. the winds on sunday night caused these trees to drop many more branches, some quite large.

an inspector needs to come ASAPO and inspect when i am home so i can show the peril we are in. VERY DANGEROUS!

also the city land next to our property is an extreme fire danger and has not been cleared in several years. why has this stopped happening?

10.10.17- am 
currently on hold at the oakland call center for over 15 minutes..",2017-10-10T14:18:04-04:00,07/31/2014 04:00:36 PM,37.81966952,-122.20091489
16,https://seeclickfix.com/files/issue_images/0033/4736/1433461434676.jpg,"Tree brace broke off, tree is now limping to the ground.",2015-06-04T19:44:27-04:00,https://seeclickfix.com/files/issue_images/0061/5400/1476232982423.jpg,This is not an emergency situation. Tree removal was slated for 10/5-10-8 per the sign and is marked as a tow away zone. When will the tree be removed?,2016-10-11T20:44:53-04:00,https://seeclickfix.com/files/issue_images/0087/1247/img-SCF__20170912_100406867941871065287826111239262994764819.jpg,2 dead elm trees on e 19th @ 16 the Ave. been dead and reported several times.,2017-09-12T13:05:49-04:00,https://seeclickfix.com/files/issue_images/0027/3996/1420488016360.jpg,Huge tree with large branches is falling onto the grass near the kids playground area in San Antonio Park.,2015-01-05T15:02:26-05:00,,"As of 8-16-2012

There are trees at 1515 14th Ave that obstructs drivers' view when approaching from East 15th Street. These trees are planted on the sidewalk and when combined with the parked cars along the curb it is a potential safety concern.",2012-08-17T00:21:35-04:00,,,,06/04/2015 04:50:18 PM,37.7912208,-122.2436748
17,,"Large tree listing to the street side - every time my tree guy comes out to trim ones on my property, he says it's going to fall down.  Today a HUGE branch broke off of it, and luckily fell into the street and not onto a car or person.  would be great to have city come take a look asap",2015-03-27T22:02:20-04:00,https://seeclickfix.com/files/issue_images/0047/5140/1460037936178.jpg,All of the trees and plots on 5th and 18th are completely over grown. ,2016-04-07T10:05:50-04:00,https://seeclickfix.com/files/issue_images/0012/6884/IMAG0089.jpg,"tree growing into powerlines
 ",2013-05-23T20:36:05-04:00,https://seeclickfix.com/files/issue_images/0036/3211/SCF__20150804_1557171282600719.jpg,Please keep a eye on the redwood tree is drying up and may fall.,2015-08-04T19:00:40-04:00,https://seeclickfix.com/files/issue_images/0049/6825/1462729380685.jpg,This is getting to be a little much. Thankfully 18th street was managed (thank you!) But it's terrible that cars can't park or exit their passengers side because a jungle is growing. It needs some help. Please! ,2016-05-08T13:44:43-04:00,https://seeclickfix.com/files/issue_images/0036/2545/IMG_0154.JPG,Needs to be cut down because of danger to public safety!,2015-08-03T15:54:53-04:00,08/03/2015 01:00:26 PM,37.79969924,-122.24828411
18,,Dead 30 ft street tree. Ongoing water leak has killed the tree. The roots my be rotten and and the tree could become a hazard if bumped by a car or strong winds. The water leak has been reported many times over several years.,2015-04-04T14:28:35-04:00,,Dead tree in parking strip in front of Shell station.,2012-11-24T21:50:29-05:00,https://seeclickfix.com/files/issue_images/0052/5155/1465936647809.jpg,"Acacia branches hanging low, hits passing vehicles. Thanks, Noel Gallo's team",2016-06-14T16:38:23-04:00,,Broken branches on sidewalk ,2015-07-11T15:57:04-04:00,,Large truck load of trimmed branch's left in parking lot. Been there a while.,2015-07-15T16:43:28-04:00,,Large tree branch in street,2017-06-18T22:01:05-04:00,10/19/2018 07:08:00 AM,37.79966354,-122.21659851
19,,Tree trunk and roots of this tree here on madison are constricted by a concrete container that surrounds the tree at its base - the roots have already broken the container a very long time ago. please remove the remaining concrete container from the base of the tree.,2013-05-09T12:26:37-04:00,,Fallen tree in roadway on Carmen Stanford side of 14th.,2013-09-26T09:40:43-04:00,, tree covering light a8138 10th and oak.,2012-10-26T22:59:51-04:00,https://seeclickfix.com/files/issue_images/0016/5575/1385484996267.jpg,,2013-11-26T11:57:08-05:00,https://seeclickfix.com/files/issue_images/0015/8898/tia1810463215.jpg,broken branch ,2013-10-14T11:18:37-04:00,https://seeclickfix.com/files/issue_images/0025/3873/1414690797809.jpg,"Truck broke tree branch, now hanging in street .",2014-10-30T13:40:15-04:00,12/30/2015 08:00:38 AM,37.80107186,-122.26289148
20,https://seeclickfix.com/files/issue_images/0047/9241/1460576604803.jpg,Still dead. Reported this a year ago,2016-04-13T15:43:34-04:00,https://seeclickfix.com/files/issue_images/0044/7131/1455909791493.jpg,Dead tree at 10th and frontage. ,2016-02-19T14:23:57-05:00,https://seeclickfix.com/files/issue_images/0067/0512/1484699506239.jpg,Dead trees along Frontage. ,2017-01-17T19:31:55-05:00,https://seeclickfix.com/files/issue_images/0044/5307/1455653261709.jpg,Fallen branch,2016-02-16T15:08:14-05:00,https://seeclickfix.com/files/issue_images/0044/7133/1455909924873.jpg,Dead trees. Many redwoods have died from drought  about 5 smaller ones. ,2016-02-19T14:25:59-05:00,https://seeclickfix.com/files/issue_images/0019/8322/1399946326565.jpg,Dead tree at 14 th and frontage rd,2014-05-12T22:00:17-04:00,02/19/2016 11:30:52 AM,37.81181288,-122.30305025
21,https://seeclickfix.com/files/issue_images/0027/6935/1421219829749.jpg,Fallen tree,2015-01-14T02:19:14-05:00,https://seeclickfix.com/files/issue_images/0061/7718/1476491463654.jpg,There is a large tree branch that fell on the sidewalk due to the rain. It would require a saw to cut down and is much larger than my green bin. ,2016-10-14T21:15:05-04:00,https://seeclickfix.com/files/issue_images/0037/9997/1441830493419.jpg,Over grown tree branches to low scratches cars,2015-09-09T16:28:35-04:00,https://seeclickfix.com/files/issue_images/0037/9994/1441830305007.jpg,Over grown tree branches to low scratches cars,2015-09-09T16:26:48-04:00,https://seeclickfix.com/files/issue_images/0038/0002/1441830609498.jpg,Over grown tree branches to low scratches cars,2015-09-09T16:30:33-04:00,https://seeclickfix.com/files/issue_images/0037/9999/1441830534490.jpg,Over grown tree branches to low scratches cars,2015-09-09T16:29:19-04:00,05/22/2013 10:31:59 AM,37.844507,-122.26507412
22,https://seeclickfix.com/files/issue_images/0015/7790/20131008_121359.jpg,"downed, broken tree",2013-10-08T15:18:26-04:00,https://seeclickfix.com/files/issue_images/0015/6960/1380902317332.jpg,Tree down in front of 3217 Lakeshore. Hit by garbage truck?,2013-10-04T11:57:55-04:00,https://seeclickfix.com/files/issue_images/0015/6949/1380900855324.jpg,"Large tree branch down in roadway, not blocking traffic but blocking 3-4 parking spaces.",2013-10-04T11:35:52-04:00,https://seeclickfix.com/files/issue_images/0016/1643/Downed_Trees.jpg,Two trees blew over in heavy winds earlier this week.  One in front of Cana and the other in front of Lane Splitter Pizza.  Both have been removed -- leaving vacant steel tree grates.  These trees were installed barely over a year ago by an outside contractor.  The root ball was obviously not placed deep enough and the trees weren't adequately staked.  What was a beautiful to the streetscape is now an eyesore and potentially hazardous.  Please note that I'm filing a separate complaint about a tree around the corner that was damaged under similar circumstances. ,2013-10-30T18:48:02-04:00,https://seeclickfix.com/files/issue_images/0016/0827/tia1145718314.jpg,"downed, broken tree",2013-10-25T16:35:45-04:00,https://seeclickfix.com/files/issue_images/0016/5309/1385248241179.jpg,Broken tree,2013-11-23T18:11:08-05:00,04/03/2016 03:00:23 PM,37.81219602,-122.24641621
