,IMAGE_URL_0,DESCRIPTION_0,SEECLICKFIX_DATE_0,IMAGE_URL_1,DESCRIPTION_1,SEECLICKFIX_DATE_1,IMAGE_URL_2,DESCRIPTION_2,SEECLICKFIX_DATE_2,IMAGE_URL_3,DESCRIPTION_3,SEECLICKFIX_DATE_3,IMAGE_URL_4,DESCRIPTION_4,SEECLICKFIX_DATE_4,IMAGE_URL_5,DESCRIPTION_5,SEECLICKFIX_DATE_5,OAK_311_DATE,LATITUDE,LONGITUDE
551,,Large acacia hanging over Sanborn Road near turn around. Please remove. Thanks!,2015-02-28T20:14:59-05:00,https://seeclickfix.com/files/issue_images/0046/3719/wild_rose_tree_-_Copy.jpg,"two large trees remain down across Wild Rose Trail (lower section, below Sequoia-Bayview).  Both are passable, but the first has created a cut off the side of the trail in order for people to get around it.  The lower tree, near the intersection with Sunset Loop, must be climbed over.  Only the lower, smaller, tree is pictured here.  The tree further up the trail is much bigger.",2016-03-19T01:30:11-04:00,,"This is a 2nd request as the tree is still  leaning off the slope over Sanborn Dr.  See Issue ID: 1507081 /Svc Rqt  ID: 569240  archive.   City of Oakland Pub Wk.s closed the issue on Apr 16, --the tree taken down was a tall dead cypress from comment 3, which by the way was removed along with a lot of other blue paint dabbed trees that needed to come out - all in all a big job.   However I guess I need to write again, that an acacia tree is leaning out towards Sanborn Drive  dragging into a lower tree - Live Oak--,  and one of these days falling onto the roadway.  It's not marked  so I can put small color penants at the trunk -- to make sure you see it.  
On Sanbn Dr  past the yellow gate, where there's a road divide and  Keep Right sign,  go down left side [northwest]35 paces or so,  and look up hill past some other trees.  "" tree is 20,30 degrees from vertical, 18 - 20 inches diameter, one branch has torn off about 10 ft up, [late Jan / early Feb] the tree reaches down into a live oak and the last third of its height leans over into the road, . Also there's native plants on that hillside like lupine, purple needlegrass, yarrow, live oak bay laurel, and note that near the base of that tree is a little poison oak 2feet away and 9 10 feet away.[just so you don't get the rash]
It's a problem tree -- going to be more troubling. ""
Friends of Sausal Crk  does some volunteer broom and acacia cutting.  Our Field coordinator says this one is too big too crooked and to look around for help.   Will you please check it out and tell us what you think about  removing it.       Thank you.       Alan  Tong",2015-05-21T03:17:24-04:00,https://seeclickfix.com/files/issue_images/0065/3458/1481820739282.jpg,Widow maker by yellow gate along Sanborn Rd bear ranger station. Please cut.,2016-12-15T11:53:20-05:00,https://seeclickfix.com/files/issue_images/0042/0742/1451243524879.jpg,Tree fell into large dog park. Fence damage,2015-12-27T14:12:25-05:00,,,,03/06/2016 04:20:22 PM,37.80937267,-122.1861217
552,,"Tree down near 4156 35th Ave, Oakland, CA.",2017-10-09T10:43:23-04:00,,A dead redwood tree in median of Redwood Road between Jordan and Monterey Blvd.  A second tree next to it is dying.  These trees are potential torches in a fire and should be removed.  I have reported it to Public Works and given the case number 668179.,2016-07-17T16:56:25-04:00,,,,,,,,,,,,,03/08/2016 09:10:15 PM,37.79725174,-122.1945478
553,,,2013-11-30T19:12:11-05:00,https://seeclickfix.com/files/issue_images/0064/2341/1479935759586.jpg,Fallen branch down at arroyo park by the tot lot close to Olive st . Thanks ,2016-11-23T16:16:53-05:00,https://seeclickfix.com/files/issue_images/0073/2136/IMG_5597.JPG,"I have reported the issue with the City of Oakland (Tree Dept.)
I purchased a house on 7539 Arthur Street on Dec. 2008
since then have had branches fallen down on my vehicle (parked on the street) in front of my house, due to the overgrown branches
The City advised that they did not have the funds available to prune/trim the tree (few years ago) which I had to pay myself because of the damages caused to my vehicles. Which was classified as an act of nature by the City. Yet I see other trees being planted in Oakland!! Don't understand how this is possible if they can't keep up with the ones already planted in dire need of trimming. Last nights wind caused a few branches to break off, the tree overhangs above my house and electrical cables...the problem with overgrown trees on Arthur Street (73rd to 78th Ave) must be resolved...They attract illegal dumping, reduce lighting and attract illegal activities.",2017-04-07T15:16:48-04:00,https://seeclickfix.com/files/issue_images/0049/7476/1462822477647.jpg,Trees in parking lot need to be trimmed so work truck's can get in.   Thanks ,2016-05-09T15:38:33-04:00,https://seeclickfix.com/files/issue_images/0050/7834/1464029217806.jpg,Low hanging branch @ arroyo Viejo behind the head start building. Thanks ,2016-05-23T14:48:03-04:00,https://seeclickfix.com/files/issue_images/0073/4211/1491841949405.jpg,Hanging Branch @ arroyo park . Along the pathway ,2017-04-10T12:33:15-04:00,03/09/2016 12:00:19 PM,37.76280655,-122.17640876
554,https://seeclickfix.com/files/issue_images/0016/4418/IMAG0035_1_.jpg,"Please send out someone to trim these 3 tree. Branches are breaking off onto parked vehicles, insurance claims ready to happen. Also, this creates a darkened area by the tree for possible robbery so be careful nurses/doctors/patient visitors!",2013-11-17T19:28:19-05:00,https://seeclickfix.com/files/issue_images/0033/2168/IMG_20150530_132153_806.jpg,Branches go nearly to the ground requiring pedestrians to walk into the street and making the ramp inaccessible. ,2015-05-30T17:47:05-04:00,,please trim  these 2 trees.,2016-03-11T01:58:44-05:00,https://seeclickfix.com/files/issue_images/0078/0820/1496160864091.jpg,The trees and shrubs in the median have completely overgrown to cover the no parking sign. I have lived here nine years and the city has never maintained the trees. Now that the signs are covered people are parking in the no parking zone and it is causing traffic hazards on a narrow street ,2017-05-30T12:17:44-04:00,https://seeclickfix.com/files/issue_images/0038/3294/1442430335459.jpg,Tree pruning needed!  Blocking sight lines for traffic. 2875 Vallecito pl. southwest corner of E31st & Vallicito,2015-09-16T15:09:09-04:00,,The first tree on E. 34th St coming from 13th Ave. has several branches down and some that are broken waiting to fall.  The broken branches are just hanging waiting to fall.,2014-12-13T16:50:41-05:00,03/10/2016 11:00:16 PM,37.80023456,-122.23202969
555,,Tree partially blocking road.,2013-11-27T12:26:06-05:00,https://seeclickfix.com/files/issue_images/0039/5885/1445022437534.jpg,Tall palm trees lining street have many dead fronds that are at risk of falling. These are near sidewalk and falling fronds could injure people or damage property. Fronds (about 25) fell from tree in front of 6071 Rockridge Blvd overnight last week. Requesting the trees be trimmed (dead fronds removed) before expected upcoming winter winds and storms.,2015-10-16T15:09:11-04:00,https://seeclickfix.com/files/issue_images/0046/0061/1457848091855.jpg,Fallen tree at the intersection of Margarido and Rockridge Blvd South. ,2016-03-13T00:48:24-05:00,https://seeclickfix.com/files/issue_images/0015/5767/Tree_root_damage_Brookside_Lane.JPG,"Acacia trees within public right-of-way alongside public stairway (Brookside Lane, between Ocean View Dr. and Brookside Ave.) are breaking wall and rotating column.  This is a historic structure.  Trees were not planted by adjacent neighbor -- they need to be cut down before further damage occurs.  FYI property line is at wooden fence.",2013-09-27T18:13:25-04:00,,,,,,,03/12/2016 09:50:14 PM,37.8452137,-122.2408926
556,,The tree in front of our house needs trimming. I have tried to hire someone but no one will touch it because it belongs to the city. Branches are now falling from the tree and my husband needs to get in a ladder to get them down. This is the 4th time I have reported this and need help. ,2016-03-18T17:16:57-04:00,https://seeclickfix.com/files/issue_images/0038/8078/1443400773617.jpg,The tree in front of my house need trimming. I have tried to hire someone to do it but no one will touch it because of the wires going through the tree. Soon it will be sagging over the sidewalk and hitting the roof of my house. Would like this taken care of before winter rains start. ,2015-09-27T20:39:18-04:00,https://seeclickfix.com/files/issue_images/0016/5497/1385423754035.jpg,Tree branch blocking street and sidewalk,2013-11-25T19:00:54-05:00,,,,,,,,,,03/18/2016 02:20:30 PM,37.77453093,-122.21378296
557,,Tree trunk and roots of this tree here on madison are constricted by a concrete container that surrounds the tree at its base - the roots have already broken the container a very long time ago. please remove the remaining concrete container from the base of the tree.,2013-05-09T12:26:37-04:00,https://seeclickfix.com/files/issue_images/0009/2035/2012-10-10_13-50-37_230.jpg,,2012-10-10T17:26:22-04:00,https://seeclickfix.com/files/issue_images/0010/4886/1360081674815.jpg,Fallen branch. ,2013-02-05T11:28:53-05:00,https://seeclickfix.com/files/issue_images/0009/7233/500A1A04-2026530.jpg,fallen tree on Alice st @ 14th st,2012-12-02T18:41:09-05:00,https://seeclickfix.com/files/issue_images/0012/6541/IMG_20130522_104653.jpg,Diseased tree needs removal. Bark on the trunk is missing and the interior of the tree is rotting.,2013-05-22T14:13:08-04:00,https://seeclickfix.com/files/issue_images/0015/8898/tia1810463215.jpg,broken branch ,2013-10-14T11:18:37-04:00,03/21/2016 08:20:19 PM,37.80384077,-122.26563373
558,https://seeclickfix.com/files/issue_images/0013/9302/1374094146264.jpg,Tree limbs blocking road,2013-07-17T16:52:34-04:00,,Big piles of extremely dry brush,2013-05-30T15:33:32-04:00,https://seeclickfix.com/files/issue_images/0068/4588/1486510136541.jpg,I will also call 510-615-5566,2017-02-07T18:29:06-05:00,https://seeclickfix.com/files/issue_images/0069/6018/1487793993180.jpg,I will also call. Tree fell and hangs over road. Will likely fall onto Escher drive and block traffic. Trucks may not be able to pass,2017-02-22T15:07:34-05:00,,Branch down across Montclair Rail Road Trail by Snake Road.,2016-06-13T14:28:58-04:00,https://seeclickfix.com/files/issue_images/0033/6978/1433881419413.jpg,Large limb falling on road. ,2015-06-09T16:23:47-04:00,04/05/2016 03:30:36 PM,37.83076199,-122.19861422
559,,"there are trees about to fall at the sidewalk and at the back of this address.kids plying on the sidewalk and there is school next block, the tree at the back is putting the family next door residence in danger. please do some thing before somebody got hurt.
part of the tree on the sidewalk had fell 3 or 4 years ago luckily it damage only the power lines only. we will never know what will happen this time",2012-04-02T13:19:25-04:00,https://seeclickfix.com/files/issue_images/0046/7264/SCF__20160324_180425-812041729.jpg,Tree branches are caught in electrical wires and can cause a power outage.  Also over hanging into property. ,2016-03-25T11:24:02-04:00,https://seeclickfix.com/files/issue_images/0048/8409/1461710367070.jpg,Broken limb on the Bancroft median @81st . Thank you ,2016-04-26T18:41:27-04:00,https://seeclickfix.com/files/issue_images/0058/6374/1472828974858.jpg,Broken limbs on the median. ,2016-09-02T11:10:19-04:00,,,,,,,03/25/2016 08:30:36 AM,37.75987518,-122.1680666
560,https://seeclickfix.com/files/issue_images/0040/0167/1446061843000.jpg,City tree is obstructing the sidewalk and at public right away in front of vacant lot on 9809 macarthur blvd,2015-10-28T17:26:33-04:00,https://seeclickfix.com/files/issue_images/0059/0913/1473362282550.jpg,Tree branch broken. Laying into the street. ,2016-09-08T15:19:18-04:00,,,,,,,,,,,,,04/18/2016 08:10:47 AM,37.74988004,-122.15876701
561,https://seeclickfix.com/files/issue_images/0067/7281/1485550233732.jpg,Power lines run through overgrown branches that will break as they have in the past. Please trim tree!,2017-01-27T21:44:08-05:00,https://seeclickfix.com/files/issue_images/0007/3843/fallen_tree_and_street_refuse_04.21.12_002.jpg,a very large tree limb with branches is in the public right of way. it is now a hiding place for illegal dumping and drug addicts and homeless people. please remove this,2012-04-21T11:20:54-04:00,https://seeclickfix.com/files/issue_images/0071/5262/1489975295939.jpg,Serious potential for damage to people and property exists. This tree has dropped branches frequently. The car in this picture has damage to the hood from a dropped branch two weeks ago. The branch needs to be cut off or it will hurt someone soon. I am reporting this to document that the City has been notified. ,2017-03-19T22:02:56-04:00,https://seeclickfix.com/files/issue_images/0068/6029/1486681789941.jpg,The branch of the eucalyptus tree has broken. There is also a broken branch hanging on the tree.,2017-02-09T18:10:37-05:00,https://seeclickfix.com/files/issue_images/0068/6031/1486681789941.jpg,The branch of the eucalyptus tree has broken. There is also a broken branch hanging on the tree.,2017-02-09T18:11:42-05:00,https://seeclickfix.com/files/issue_images/0070/5846/1488920720332.jpg,This tree again dropped branches. Three trees on this block continually drop branches and someday will seriously hurt someone. The City will experience significant liability as I am documenting the number of times branches fall and damage property. The City is negligent in not taking care of necessary pruning. These trees need to be replaced with any other type of tree! ,2017-03-07T16:05:46-05:00,04/19/2016 10:40:51 AM,37.77782714,-122.22882069
562,https://seeclickfix.com/files/issue_images/0030/9608/1428540255250.jpg,need some maintainance. ,2015-04-08T20:44:23-04:00,,hazardous tree at the residence:  3232 Elmwood Avenue. Tree well far beyond the sidewalk and the tree branches are so low and heavy you can't walk through the sidewalk.  Peoplel must walk around the sidewalk into the street to get by putting children at risk. ,2016-11-04T12:32:16-04:00,https://seeclickfix.com/files/issue_images/0022/9776/1407986293963.jpg,Large fallen tree branch (on my car - I was able to drive it away from the branch),2014-08-13T23:18:33-04:00,https://seeclickfix.com/files/issue_images/0022/9741/1407980737420.jpg,Tree fallen in street. Blocking Ford st 94601,2014-08-13T21:46:17-04:00,,"The palm tree in front of 614 Lancaster is full of dead leaves/branches and is a fire hazard. It needs to be trimmed asap. Pictures of the tree can be seen here: https://www.google.com/maps/place/3057+E+7th+St,+Oakland,+CA+94601/@37.7724298,-122.2295578,3a,75y,132.77h,103.29t/data=!3m7!1e1!3m5!1sIBRN4sazyZ0FwPuA_EG63w!2e0!6s%2F%2Fgeo2.ggpht.com%2Fcbk%3Fpanoid%3DIBRN4sazyZ0FwPuA_EG63w%26output%3Dthumbnail%26cb_client%3Dmaps_sv.tactile.gps%26thumb%3D2%26w%3D203%26h%3D100%26yaw%3D31.292292%26pitch%3D0%26thumbfov%3D100!7i13312!8i6656!4m5!3m4!1s0x808f868d37383801:0xedf176254a1c64ec!8m2!3d37.7725655!4d-122.2295961",2016-12-22T17:28:00-05:00,,,,04/26/2016 05:40:27 PM,37.77184785,-122.22999014
563,https://seeclickfix.com/files/issue_images/0015/7392/tia-1666823196.jpg,huge fallen branch,2013-10-06T14:12:09-04:00,https://seeclickfix.com/files/issue_images/0009/7198/1354462287754.jpg,Fallen tree blocking the street on 51st between west and MLK,2012-12-02T10:35:47-05:00,https://seeclickfix.com/files/issue_images/0009/9458/1356549415388.jpg,Over growth of tree. I don't feel safe walking by with obstructed sidewalk view at night. One must duck to get past overhang. Also encroaching on power lines above.,2012-12-26T14:20:32-05:00,https://seeclickfix.com/files/issue_images/0035/6664/IMG_1372.JPG,"A large part of this tree has fallen down.  It needs to be
removed ASAP because it's blocking the street and
sidewalk.  This is a City of Oakland tree.  Please
call me if you have any questions.
 Thanks so much!",2015-07-21T22:06:08-04:00,https://seeclickfix.com/files/issue_images/0015/4500/tia-1165601503.jpg,"broken branch, hanging loose. this tree had another such branch removed about a month ago.",2013-09-21T13:31:15-04:00,,Overgrown bushes obstructing road visibility at crosswalk. Please trim very low or remove,2016-10-10T14:48:15-04:00,04/26/2016 09:10:18 PM,37.83908443,-122.26863193
564,https://seeclickfix.com/files/issue_images/0013/1952/1371258790210.jpg,Tree branch diwn,2013-06-14T21:15:24-04:00,https://seeclickfix.com/files/issue_images/0070/1268/3.jpg,"There is a large damaged tree limb hanging over the road at the intersection of Aspinwall & Gouldin, Oakland, CA.  The limb appears to weigh thousands of pounds.  

The limb appears to have been struck from below. Several tall trucks are working in the area at a house three (3) houses up Gouldin and pass-by this location daily.

Confirmation No: #714617
",2017-03-01T11:16:45-05:00,,,,,,,,,,,,,05/09/2016 09:11:33 AM,37.83712616,-122.21120368
565,https://seeclickfix.com/files/issue_images/0013/1952/1371258790210.jpg,Tree branch diwn,2013-06-14T21:15:24-04:00,https://seeclickfix.com/files/issue_images/0070/1268/3.jpg,"There is a large damaged tree limb hanging over the road at the intersection of Aspinwall & Gouldin, Oakland, CA.  The limb appears to weigh thousands of pounds.  

The limb appears to have been struck from below. Several tall trucks are working in the area at a house three (3) houses up Gouldin and pass-by this location daily.

Confirmation No: #714617
",2017-03-01T11:16:45-05:00,,,,,,,,,,,,,05/09/2016 09:12:08 AM,37.83685746,-122.21130319
566,,,2013-11-30T19:12:11-05:00,https://seeclickfix.com/files/issue_images/0064/2341/1479935759586.jpg,Fallen branch down at arroyo park by the tot lot close to Olive st . Thanks ,2016-11-23T16:16:53-05:00,https://seeclickfix.com/files/issue_images/0073/2136/IMG_5597.JPG,"I have reported the issue with the City of Oakland (Tree Dept.)
I purchased a house on 7539 Arthur Street on Dec. 2008
since then have had branches fallen down on my vehicle (parked on the street) in front of my house, due to the overgrown branches
The City advised that they did not have the funds available to prune/trim the tree (few years ago) which I had to pay myself because of the damages caused to my vehicles. Which was classified as an act of nature by the City. Yet I see other trees being planted in Oakland!! Don't understand how this is possible if they can't keep up with the ones already planted in dire need of trimming. Last nights wind caused a few branches to break off, the tree overhangs above my house and electrical cables...the problem with overgrown trees on Arthur Street (73rd to 78th Ave) must be resolved...They attract illegal dumping, reduce lighting and attract illegal activities.",2017-04-07T15:16:48-04:00,https://seeclickfix.com/files/issue_images/0049/7476/1462822477647.jpg,Trees in parking lot need to be trimmed so work truck's can get in.   Thanks ,2016-05-09T15:38:33-04:00,https://seeclickfix.com/files/issue_images/0050/7834/1464029217806.jpg,Low hanging branch @ arroyo Viejo behind the head start building. Thanks ,2016-05-23T14:48:03-04:00,https://seeclickfix.com/files/issue_images/0073/4211/1491841949405.jpg,Hanging Branch @ arroyo park . Along the pathway ,2017-04-10T12:33:15-04:00,05/09/2016 12:40:37 PM,37.7628115,-122.17642195
567,https://seeclickfix.com/files/issue_images/0007/3643/tixhr-46004739.png,Broken tree branches blocking the sidewalk.  1409 17th Street.,2012-04-18T21:03:35-04:00,https://seeclickfix.com/files/issue_images/0031/8686/1430345965243.jpg,Someone knocked down 2 trees. ,2015-04-29T18:19:59-04:00,https://seeclickfix.com/files/issue_images/0075/1438/IMG_0427.JPG,Tree is broken and part of the tree is hanging.,2017-04-28T19:19:53-04:00,https://seeclickfix.com/files/issue_images/0075/4080/1493694719043.jpg,Growing crooked and you can't walk on sidewalk past street tree across from 1234 union,2017-05-01T23:12:05-04:00,https://seeclickfix.com/files/issue_images/0076/3952/1494288401255.jpg,"Trees on union between 12 and 14 are awful.  You can't walk on west side of street.  They don't grow straight they grow crooked, and are more like bushes than trees.  One was even cut down to a 3' stump and is now really growing like a bush.  Can we rip these out for something better?  ",2017-05-11T20:19:54-04:00,https://seeclickfix.com/files/issue_images/0083/8110/1501772830078.jpg,The trees are so over grown they are in the city power lines pretty badly. Also because of the trees the street sweeper can't clean the street ,2017-08-03T11:47:17-04:00,05/11/2016 05:00:30 PM,37.81071448,-122.29156954
568,https://seeclickfix.com/files/issue_images/0015/7790/20131008_121359.jpg,"downed, broken tree",2013-10-08T15:18:26-04:00,https://seeclickfix.com/files/issue_images/0015/6960/1380902317332.jpg,Tree down in front of 3217 Lakeshore. Hit by garbage truck?,2013-10-04T11:57:55-04:00,https://seeclickfix.com/files/issue_images/0015/6949/1380900855324.jpg,"Large tree branch down in roadway, not blocking traffic but blocking 3-4 parking spaces.",2013-10-04T11:35:52-04:00,https://seeclickfix.com/files/issue_images/0016/1643/Downed_Trees.jpg,Two trees blew over in heavy winds earlier this week.  One in front of Cana and the other in front of Lane Splitter Pizza.  Both have been removed -- leaving vacant steel tree grates.  These trees were installed barely over a year ago by an outside contractor.  The root ball was obviously not placed deep enough and the trees weren't adequately staked.  What was a beautiful to the streetscape is now an eyesore and potentially hazardous.  Please note that I'm filing a separate complaint about a tree around the corner that was damaged under similar circumstances. ,2013-10-30T18:48:02-04:00,https://seeclickfix.com/files/issue_images/0016/0827/tia1145718314.jpg,"downed, broken tree",2013-10-25T16:35:45-04:00,https://seeclickfix.com/files/issue_images/0016/5993/Tree_Akimbo.jpg,This is one of about 10 street trees that were planted just over a year ago as part of the Lakeshore Complete Streets Improvement Project.  Three have already fallen and been removed.  At least three others have snapped off part way up the trunk including one on Rand that's two-thirds gone.  This can't be coincidental.  Blame has to go to the contractors who installed the trees without adequate staking and most likely too shallow with too little soil compaction.  The trees need to be replaced.  It would be nice to see it done at the contractor's expense - not the city's. ,2013-12-01T18:09:07-05:00,05/03/2016 08:00:23 PM,37.80876958,-122.2481884
569,https://seeclickfix.com/files/issue_images/0083/0747/1501070968619.jpg,There is a falling tree on the freeway side that has fallen over the fence and is partially in the street. Someone cut it but did not remove the rest of the tree. ,2017-07-26T08:09:43-04:00,https://seeclickfix.com/files/issue_images/0083/0748/1501070968619.jpg,There is a falling tree on the freeway side that has fallen over the fence and is partially in the street. Someone cut it but did not remove the rest of the tree. ,2017-07-26T08:09:50-04:00,,,,,,,,,,,,,05/17/2016 06:50:20 PM,37.74242061,-122.14498929
570,,"Trees overgrown, blocking sidewalk",2013-07-23T03:22:14-04:00,https://seeclickfix.com/files/issue_images/0009/6609/1353872975718.jpg,Tree needs help,2012-11-25T14:50:40-05:00,https://seeclickfix.com/files/issue_images/0086/5187/IMG_6434.JPG,Kinda hard to see the parking signs... also only one street sweeping sign on this entire block,2017-09-05T11:05:02-04:00,,Congratulations Campbell St regulars! You've @#$% on this tree so much it's toppled at the base and fallen over onto the sidewalk. ,2014-12-04T16:45:36-05:00,https://seeclickfix.com/files/issue_images/0064/1268/1479778194736.jpg,"Tree struck by driver and broken, large branch hanging in the bike lane on southbound Mandela Pkwy, south of 5th Street.",2016-11-21T20:31:38-05:00,https://seeclickfix.com/files/issue_images/0089/6070/75C8E088-6C9C-43FD-B8D7-99D9E212FF0B.jpeg,Need pruning.... theres a no parking street sweeping sign in there somewhere... ,2017-10-15T15:08:51-04:00,05/24/2016 04:19:46 PM,37.80588975,-122.29714375
571,https://seeclickfix.com/files/issue_images/0016/5143/tia-32122216.jpg,Fallen tree blocking sidewalk along southbound Telegraph Avenue between 39th Street and Apgar Street. ,2013-11-22T17:15:05-05:00,https://seeclickfix.com/files/issue_images/0032/9668/38th___Webster.jpg,The fruit tree hanging over the fence on the east side of Webster here is at face level with an average-sized adult. It needs to be trimmed judiciously.,2015-05-25T16:46:48-04:00,https://seeclickfix.com/files/issue_images/0033/8140/1434075868600.jpg,Tree is growing in front of traffic signal at 42nd & Telegraph and needs to be trimmed.,2015-06-11T22:25:24-04:00,https://seeclickfix.com/files/issue_images/0027/0081/40th___Clarke.jpg,"The sidewalk on Clarke Street, at the southeast corner of the intersection, is now completely impassable.",2014-12-22T10:34:43-05:00,https://seeclickfix.com/files/issue_images/0052/9483/1466437195074.jpg,Broken tree branch covering sidewalk for about a week,2016-06-20T11:40:49-04:00,https://seeclickfix.com/files/issue_images/0078/4516/1495830493969.jpg,,2017-06-02T13:26:06-04:00,06/02/2016 06:09:58 PM,37.82926926,-122.26450683
