,IMAGE_URL_0,DESCRIPTION_0,SEECLICKFIX_DATE_0,IMAGE_URL_1,DESCRIPTION_1,SEECLICKFIX_DATE_1,IMAGE_URL_2,DESCRIPTION_2,SEECLICKFIX_DATE_2,IMAGE_URL_3,DESCRIPTION_3,SEECLICKFIX_DATE_3,IMAGE_URL_4,DESCRIPTION_4,SEECLICKFIX_DATE_4,IMAGE_URL_5,DESCRIPTION_5,SEECLICKFIX_DATE_5,OAK_311_DATE,LATITUDE,LONGITUDE
362,https://seeclickfix.com/files/issue_images/0007/3643/tixhr-46004739.png,Broken tree branches blocking the sidewalk.  1409 17th Street.,2012-04-18T21:03:35-04:00,https://seeclickfix.com/files/issue_images/0031/8686/1430345965243.jpg,Someone knocked down 2 trees. ,2015-04-29T18:19:59-04:00,https://seeclickfix.com/files/issue_images/0075/1438/IMG_0427.JPG,Tree is broken and part of the tree is hanging.,2017-04-28T19:19:53-04:00,,there is a tree here that lost a ton of branches somehow and they're all over the sidewalk and street. I tried to clear the sidewalk but the street cleaner went around the mess cuz the tree branches are so low it couldn't get under to clean by the curb. I think this tree needs trimming as well as some cleanup underneath. please come help. thank you. ,2017-09-09T15:40:02-04:00,https://seeclickfix.com/files/issue_images/0081/8434/1499829772080.jpg,Broken trunk at SE corner of Mandela and 16,2017-07-11T23:24:13-04:00,https://seeclickfix.com/files/issue_images/0029/1367/1424560449564.jpg,Fallen tree. Non-emergency situation. ,2015-02-21T18:14:15-05:00,10/20/2018 01:42:15 PM,37.8120139,-122.2928127
363,https://seeclickfix.com/files/issue_images/0016/5032/1385127988497.jpg,,2013-11-22T08:47:15-05:00,https://seeclickfix.com/files/issue_images/0016/7178/1386936553939.jpg,"Tree limbs from windstorm still piled on sidewalk, now gathering litter.",2013-12-13T07:12:05-05:00,https://seeclickfix.com/files/issue_images/0016/5257/image.jpg,Several large branches down in street (moved to side by neighbor). ,2013-11-23T12:26:16-05:00,,Large Broken limb blocking side walk,2016-03-19T13:06:56-04:00,https://seeclickfix.com/files/issue_images/0018/8773/1397105589818.jpg,Tree is fully blocked by the light - this steer is dangerously dark,2014-04-10T00:53:58-04:00,https://seeclickfix.com/files/issue_images/0061/7718/1476491463654.jpg,There is a large tree branch that fell on the sidewalk due to the rain. It would require a saw to cut down and is much larger than my green bin. ,2016-10-14T21:15:05-04:00,07/31/2018 05:46:02 PM,37.8428763,-122.26158904
364,,"Large (but not huge) tree limb (tree in parking strip) came down last night partially block street. No longer an emergency. I pulled it out of the street and cut it up with a chain saw but the debris needs to be hauled away. No one hit the tree. Just the dry weather and weight of the limb  brought it down (ornamental, flowering pear tree).",2014-10-04T19:13:15-04:00,https://seeclickfix.com/files/issue_images/0026/7258/1418419559867.jpg,Dangerous fallen tree on school sidewalk at side entrance of Sequoia elementary,2014-12-12T16:27:02-05:00,,,,,,,,,,,,,10/21/2018 11:28:43 AM,37.80439134,-122.20822687
365,https://seeclickfix.com/files/issue_images/0020/9595/image.jpeg,"there are two trees North side of 33rd st. leaning over to the travel way, as the result, City's street cleaning vehicles would go around these trees avoid to hit these branches.
Hence garbage and trash are not pick up.  Can the City trim these trees or remove them?  One of the big tree in the photo became a normal dumping area because it conceals the illegal activities.  Thank you.",2014-06-19T19:31:07-04:00,https://seeclickfix.com/files/issue_images/0072/4810/This_Tree.JPG,THIS IS NOT AN EMERGENCY. It is simply a nuisance at this point. I would like to request to have the public tree brushing against my house be trimmed and maintained. When it brushes against my house at night it is loud and prevents me from sleeping. If the tree cannot be maintained them please remove/relocate it. Please help.,2017-03-30T13:19:24-04:00,https://seeclickfix.com/files/issue_images/0032/4510/IMG_20150512_134408.jpg,Both stakes were broken by vandals,2015-05-12T23:23:28-04:00,https://seeclickfix.com/files/issue_images/0074/5547/1492898103898.jpg,Branches down on the sidewalk,2017-04-22T17:56:14-04:00,https://seeclickfix.com/files/issue_images/0041/5994/IMG_2105.jpg,Tree is overgrown and is blocking the sidewalk/parking.,2015-12-11T13:41:50-05:00,https://seeclickfix.com/files/issue_images/0022/0900/IMAG3126.jpg,             Caltrans cleared the brush and limbs but didn't take away the debris its been there for over a month. Extreme fire hazard. Garbage pile as well,2014-07-22T12:13:21-04:00,10/23/2018 02:54:09 PM,37.82554504,-122.2751868
366,https://seeclickfix.com/files/issue_images/0015/5737/1380307194852.jpg,Please send tree crew to remove large cones from Bunya-bunya trees. The cones each weigh 5-8 lbs and pose an extreme hazard when falling from trees. ,2013-09-27T14:42:19-04:00,https://seeclickfix.com/files/issue_images/0012/5470/1368826386738.jpg,Tree fell,2013-05-17T17:37:12-04:00,https://seeclickfix.com/files/issue_images/0016/5802/1385663593992.jpg,FIRE HAZARD -- Tree debris fire hazard to homes. Huge leafy euc tree branch. Located at edge of  Montclair RR Trail (below adjacent 1900 block of Magellan).    Accessed from village Mountain Blvd at the Pacific Union building (across street from tennis courts),2013-11-28T14:28:45-05:00,,"The walk way near the recreation center is still restricted due to tree/ pine cone maintenance. Will the project be done soon? If the work is still in progress, can we have it retagged for safety. There is a youth walk schedule for this Saturday and some concern has been raised around the pathway being restricted the walk is to happen to the path that is blocked. Can someone contact the recreation center with information regarding this work request. 510-482-7812 Briana Fisher ",2014-10-16T16:29:01-04:00,https://seeclickfix.com/files/issue_images/0024/2041/beginning_of_school_trail.JPG,Eucalyptus tree down blocking the trail to Montclair Grammer School. Just behind McCallou's store on Medau,2014-09-16T14:22:13-04:00,,"The trees were trimmed on 1/19 along Moraga and the branches are still sitting at intervals along Moraga Avenue taking up about 10 parking spaces.  If it is Caltrans or a contractor who did the trimming, please make them come back and finish the job by picking up the mess.",2014-01-25T22:43:17-05:00,10/25/2018 03:22:45 PM,37.82887946,-122.21290027
367,https://seeclickfix.com/files/issue_images/0073/2136/IMG_5597.JPG,"I have reported the issue with the City of Oakland (Tree Dept.)
I purchased a house on 7539 Arthur Street on Dec. 2008
since then have had branches fallen down on my vehicle (parked on the street) in front of my house, due to the overgrown branches
The City advised that they did not have the funds available to prune/trim the tree (few years ago) which I had to pay myself because of the damages caused to my vehicles. Which was classified as an act of nature by the City. Yet I see other trees being planted in Oakland!! Don't understand how this is possible if they can't keep up with the ones already planted in dire need of trimming. Last nights wind caused a few branches to break off, the tree overhangs above my house and electrical cables...the problem with overgrown trees on Arthur Street (73rd to 78th Ave) must be resolved...They attract illegal dumping, reduce lighting and attract illegal activities.",2017-04-07T15:16:48-04:00,https://seeclickfix.com/files/issue_images/0082/9577/dragmarker-60bca068454230dd73b20bbeb88fd475c4129b2c610a3cd32affd2026b77c5d4_1_.gif,Tree has grown too high and is a hazard ,2017-07-24T20:20:29-04:00,https://seeclickfix.com/files/issue_images/0066/5900/Untitled.jpg,Hazardous Tree. It sways and leans each time the wind blows. The ground is so wet the tree will fall over and fall right into live power lines and damage City of Oakland Property. The tree is the tallest tree in the photo. . Its a Palm Tree that may be estimated at over 200 feet high. If you can inspect the tree because it is hazardous. ,2017-01-10T12:30:46-05:00,https://seeclickfix.com/files/issue_images/0043/6488/1454100178832.jpg,"January 29,2016 12:26 pm. Lisense plate number T629041 dong fang",2016-01-29T15:44:06-05:00,,,,,,,07/24/2017 05:20:31 PM,37.76283585,-122.18117321
368,https://seeclickfix.com/files/issue_images/0009/2035/2012-10-10_13-50-37_230.jpg,,2012-10-10T17:26:22-04:00,https://seeclickfix.com/files/issue_images/0015/9502/1382027766966.jpg,Large Dead tree branch dangling from tree. Right at base of 15th street. West side of broadway. ,2013-10-17T13:46:49-04:00,https://seeclickfix.com/files/issue_images/0034/2719/c253640.jpeg,Tree grate on the southwest of 10 and broadway near the courtyard ,2015-06-22T16:38:35-04:00,https://seeclickfix.com/files/issue_images/0052/7819/1466201040870.jpg,"Man fell. Hurt his elbow and broke his camera. This event occurred on Thursday June 16, 2016 around 10 a.m. There are two of them in the same area. ",2016-06-17T18:07:41-04:00,https://seeclickfix.com/files/issue_images/0053/0566/1466530462033.jpg,Well very sunk in. Man tripped and fell. ,2016-06-21T13:35:40-04:00,https://seeclickfix.com/files/issue_images/0035/6661/b7140f0.jpeg,Large tree branch in parking lot drive way. ,2015-07-21T21:54:37-04:00,05/09/2013 09:41:33 AM,37.80771396,-122.26901618
369,https://seeclickfix.com/files/issue_images/0015/7755/1381248493749.jpg,Broken blocking  sidewalk,2013-10-08T12:09:50-04:00,https://seeclickfix.com/files/issue_images/0008/5000/43aba0.jpeg,"2 dying trees
1 w/ large branch on ground that could have killed someone
416 staten ",2012-08-05T11:10:00-04:00,https://seeclickfix.com/files/issue_images/0068/4461/img-801-1247582204.jpg,A tree has fallen in Lakeside Park at Bellevue and Staten ,2017-02-07T15:59:57-05:00,https://seeclickfix.com/files/issue_images/0031/3944/1429393037620.jpg,Limb down ,2015-04-18T17:38:19-04:00,https://seeclickfix.com/files/issue_images/0018/6949/1396569205254.jpg,Tree falling into lake west end of pergola colonnade ,2014-04-03T19:54:08-04:00,https://seeclickfix.com/files/issue_images/0032/6353/1431897101181.jpg,Limb broken off Australian tea tree hanging into lake,2015-05-17T17:12:14-04:00,05/14/2013 05:21:31 PM,37.80864846,-122.25300147
370,https://seeclickfix.com/files/issue_images/0031/7058/1430066477002.jpg,15 foot branch fell onto sidewalk,2015-04-26T12:41:26-04:00,https://seeclickfix.com/files/issue_images/0048/6502/1461519115801.jpg,Branches hanging out in the road ,2016-04-24T13:33:41-04:00,https://seeclickfix.com/files/issue_images/0053/1039/1466567887669.jpg,Tree branch fallen on car,2016-06-21T23:59:46-04:00,https://seeclickfix.com/files/issue_images/0011/7234/1365700122397.jpg,"Non an emergency, but a safety issue. Low growing tree can provide more lighting if trimmed of the bottom branches. We love our trees but please lift the lower branches at the corner of Adams and Lee. Thanks. We are having auto breaking on Adams St.",2013-04-11T13:12:26-04:00,,"Large tree branch fell approx 8/10/15, blocking sidewalk. Due to the time down, it is now very dead/dry and a potential fire hazard in addition to being an obstacle. ",2015-08-18T15:59:46-04:00,https://seeclickfix.com/files/issue_images/0084/1334/1502128442368.jpg,The very large street tree (a Liquidambar) at this location has died and needs to be removed. It has large branches stretching out to the sides presenting hazard. ,2017-08-07T13:54:33-04:00,04/11/2013 10:21:45 AM,37.81323364,-122.25792521
371,https://seeclickfix.com/files/issue_images/0010/3486/tia-745695205.jpg,wires in trees,2013-01-28T14:02:19-05:00,https://seeclickfix.com/files/issue_images/0010/7713/1361635096292.jpg,Tree tagged with graffiti :(,2013-02-23T11:00:14-05:00,https://seeclickfix.com/files/issue_images/0064/4520/img-SCF__20161129_085149-6352125061687939577.jpg,There are trees hanging over our fence that are on 52nd street at the end. They need to be trimmed as they are growing onto our property and very low to the ground.,2016-11-29T12:24:15-05:00,,,,,,,,,,05/18/2013 11:31:55 AM,37.83784106,-122.27608218
372,https://seeclickfix.com/files/issue_images/0012/6884/IMAG0089.jpg,"tree growing into powerlines
 ",2013-05-23T20:36:05-04:00,https://seeclickfix.com/files/issue_images/0036/3211/SCF__20150804_1557171282600719.jpg,Please keep a eye on the redwood tree is drying up and may fall.,2015-08-04T19:00:40-04:00,https://seeclickfix.com/files/issue_images/0036/2545/IMG_0154.JPG,Needs to be cut down because of danger to public safety!,2015-08-03T15:54:53-04:00,,Palm tree trimmings encroaching street and sidewalk ,2017-04-15T21:28:33-04:00,https://seeclickfix.com/files/issue_images/0041/8899/1450642928126.jpg,There is a tree growing out of the sidewalk at Newton and Park. ,2015-12-20T15:22:40-05:00,,,,05/23/2013 05:41:57 PM,37.8021479,-122.24736703
373,https://seeclickfix.com/files/issue_images/0030/3341/SCF__20150324_1855111060038476.jpg,"Large tree branch on sidewalk from city tree in front of 321/323 Oakland Ave... Please pickup. 

This tree is a nuisance and the city has done nothing to help. Over the years it has... 

1) TOTALLED my car when a branch fell on it during a wind storm. 

2) Broken my sewer main to the street ($4000)

3) Overgrown so much onto my house that I had to pay someone to trim it because the city wouldn't ($1000)

4) Constantly has branches and leaves falling from it that need to be cleaned up ($20 every 2 weeks to  my teenage neighbor) 

I have not once  seen the city do  anything to  the tree in the 8 years I have lived here... PLEASE MAINTAIN",2015-03-24T22:20:31-04:00,https://seeclickfix.com/files/issue_images/0031/7058/1430066477002.jpg,15 foot branch fell onto sidewalk,2015-04-26T12:41:26-04:00,https://seeclickfix.com/files/issue_images/0018/6941/1396567624891.jpg,2 dead trees ,2014-04-03T19:27:54-04:00,https://seeclickfix.com/files/issue_images/0053/1039/1466567887669.jpg,Tree branch fallen on car,2016-06-21T23:59:46-04:00,,This tree/brush needs to be severely trimmed. The bus cannot see the bus stop and people waiting at the stop until they are on top of it. The people at the stop cannot see the bus coming unless they stand in the street. It needs to be trimmed way back. Also approaching traffic cannot see pedestrians waiting to cross at the crosswalk because of it,2016-06-15T21:01:07-04:00,https://seeclickfix.com/files/issue_images/0045/5969/image.jpeg,A city owned tree has gone down and sidewalk is blocked. ,2016-03-06T04:37:41-05:00,05/31/2013 01:11:57 PM,37.81541745,-122.25731026
374,https://seeclickfix.com/files/issue_images/0015/2380/1378942338263.jpg,"These trees cover the steps that lead from 28th st to Hamilton place. Due to the trees hanging over, there are people hanging out and smoking drugs. ",2013-09-11T19:38:30-04:00,https://seeclickfix.com/files/issue_images/0008/2831/imag0789.jpg,falling dead tree on 29,2012-07-14T23:01:01-04:00,https://seeclickfix.com/files/issue_images/0007/8477/tixhr-2055020688.png,branches falling on cars and sidewalk of this Dead tree,2012-06-06T13:16:02-04:00,https://seeclickfix.com/files/issue_images/0030/3341/SCF__20150324_1855111060038476.jpg,"Large tree branch on sidewalk from city tree in front of 321/323 Oakland Ave... Please pickup. 

This tree is a nuisance and the city has done nothing to help. Over the years it has... 

1) TOTALLED my car when a branch fell on it during a wind storm. 

2) Broken my sewer main to the street ($4000)

3) Overgrown so much onto my house that I had to pay someone to trim it because the city wouldn't ($1000)

4) Constantly has branches and leaves falling from it that need to be cleaned up ($20 every 2 weeks to  my teenage neighbor) 

I have not once  seen the city do  anything to  the tree in the 8 years I have lived here... PLEASE MAINTAIN",2015-03-24T22:20:31-04:00,https://seeclickfix.com/files/issue_images/0038/0584/1441915433521.jpg,Large fallen tree limb on street blocking driveway. ,2015-09-10T16:06:41-04:00,https://seeclickfix.com/files/issue_images/0053/5239/1467001564527.jpg,"Broken tree, big branches hanging off and another big one on the sidewalk. Not an emergency.",2016-06-27T00:36:07-04:00,07/07/2013 11:18:57 AM,37.81895311,-122.26004186
375,,Dead tree in parking strip in front of Shell station.,2012-11-24T21:50:29-05:00,https://seeclickfix.com/files/issue_images/0052/5155/1465936647809.jpg,"Acacia branches hanging low, hits passing vehicles. Thanks, Noel Gallo's team",2016-06-14T16:38:23-04:00,,"Street tree on the southwest corner of School/Champion has dropped two very large branches on the sidewalk over the past three days. The limbs have been cut up and moved off the sidewalk, but there is still a potential that another large branch could come down - as well as the debris that needs to be chopped up and hauled away. ",2015-07-07T20:14:37-04:00,,Broken branches on sidewalk ,2015-07-11T15:57:04-04:00,,Large truck load of trimmed branch's left in parking lot. Been there a while.,2015-07-15T16:43:28-04:00,,Not an emergency will call. Large tree limb broke off and laying in one of the parking stalls in the Bienati public parking lot.,2016-10-08T14:41:49-04:00,06/23/2013 02:05:02 PM,37.79729818,-122.21841209
376,https://seeclickfix.com/files/issue_images/0009/6973/1354232837046.jpg,Broken tree stake. ,2012-11-29T18:49:54-05:00,https://seeclickfix.com/files/issue_images/0046/0924/1458001442719.jpg,Tree branch barely hanging on last limb,2016-03-14T20:25:26-04:00,https://seeclickfix.com/files/issue_images/0012/6634/1369268795630.jpg,Broken stake at marston Campbell park on 16th street side,2013-05-22T20:27:34-04:00,https://seeclickfix.com/files/issue_images/0012/3584/1368133684645.jpg,Tree overgrown into playground blocking access to playground equipment at marston Campbell park. ,2013-05-09T17:09:34-04:00,https://seeclickfix.com/files/issue_images/0012/6635/1369268846936.jpg,Tree needs pruning as its blocking children's access to playground at marston Campbell park,2013-05-22T20:28:54-04:00,,,,05/22/2013 05:33:52 PM,37.809441,-122.27893742
377,https://seeclickfix.com/files/issue_images/0021/3884/tree_blocking_bus_stop_Telegraph_51st.JPG,Tree is blocking bus stop.  Please have tree trimmed or removed so drivers can see if passengers are waiting at the bus stop. Thank you!,2014-07-02T11:33:24-04:00,https://seeclickfix.com/files/issue_images/0016/7178/1386936553939.jpg,"Tree limbs from windstorm still piled on sidewalk, now gathering litter.",2013-12-13T07:12:05-05:00,,Tree in the public right of way on the northeast side of the street,2013-11-26T14:15:47-05:00,https://seeclickfix.com/files/issue_images/0035/6664/IMG_1372.JPG,"A large part of this tree has fallen down.  It needs to be
removed ASAP because it's blocking the street and
sidewalk.  This is a City of Oakland tree.  Please
call me if you have any questions.
 Thanks so much!",2015-07-21T22:06:08-04:00,,"City pine tree branches low and over my backyard on 5025 Lawton Ave Oakland Ca, 94609. Tree seems to be leaning needs to be checked for health and safety.  ",2015-08-17T15:28:18-04:00,,rare and historic yew tree needs maintenance,2012-11-27T20:37:42-05:00,06/28/2013 04:33:36 PM,37.83935131,-122.26554325
378,https://seeclickfix.com/files/issue_images/0024/3940/SCF__20140923_1201301818255489.jpg,,2014-09-23T15:08:21-04:00,https://seeclickfix.com/files/issue_images/0014/5932/DSC_1726.png,"There used to be a street tree in front of Rumbo al Sur at 4239 Park Blvd. Now, there are only 2 poles left, to hold up the disappeared tree. This appears to be an Oakland city tree.

Perhaps the tree was hit by a car. Perhaps it died an untimely death.

In any case, it would be nice if the city would replace the tree.
",2013-08-14T01:54:28-04:00,,,,,,,,,,,,,06/28/2013 06:43:56 PM,37.80753003,-122.22143809
379,https://seeclickfix.com/files/issue_images/0015/2380/1378942338263.jpg,"These trees cover the steps that lead from 28th st to Hamilton place. Due to the trees hanging over, there are people hanging out and smoking drugs. ",2013-09-11T19:38:30-04:00,https://seeclickfix.com/files/issue_images/0008/2831/imag0789.jpg,falling dead tree on 29,2012-07-14T23:01:01-04:00,https://seeclickfix.com/files/issue_images/0007/8477/tixhr-2055020688.png,branches falling on cars and sidewalk of this Dead tree,2012-06-06T13:16:02-04:00,https://seeclickfix.com/files/issue_images/0038/0584/1441915433521.jpg,Large fallen tree limb on street blocking driveway. ,2015-09-10T16:06:41-04:00,https://seeclickfix.com/files/issue_images/0018/6941/1396567624891.jpg,2 dead trees ,2014-04-03T19:27:54-04:00,https://seeclickfix.com/files/issue_images/0016/8327/1387759982839.jpg,"Tree branches debris left on Brook St ROW from last big wind storm. Property owner has not removed. Can PW help/remove? Thanks, as always. ",2013-12-22T19:58:54-05:00,07/07/2013 11:18:41 AM,37.81927768,-122.25964903
380,https://seeclickfix.com/files/issue_images/0015/2380/1378942338263.jpg,"These trees cover the steps that lead from 28th st to Hamilton place. Due to the trees hanging over, there are people hanging out and smoking drugs. ",2013-09-11T19:38:30-04:00,https://seeclickfix.com/files/issue_images/0008/2831/imag0789.jpg,falling dead tree on 29,2012-07-14T23:01:01-04:00,https://seeclickfix.com/files/issue_images/0007/8477/tixhr-2055020688.png,branches falling on cars and sidewalk of this Dead tree,2012-06-06T13:16:02-04:00,https://seeclickfix.com/files/issue_images/0038/0584/1441915433521.jpg,Large fallen tree limb on street blocking driveway. ,2015-09-10T16:06:41-04:00,https://seeclickfix.com/files/issue_images/0053/5239/1467001564527.jpg,"Broken tree, big branches hanging off and another big one on the sidewalk. Not an emergency.",2016-06-27T00:36:07-04:00,https://seeclickfix.com/files/issue_images/0016/8327/1387759982839.jpg,"Tree branches debris left on Brook St ROW from last big wind storm. Property owner has not removed. Can PW help/remove? Thanks, as always. ",2013-12-22T19:58:54-05:00,07/07/2013 11:28:53 AM,37.81834147,-122.26102184
381,https://seeclickfix.com/files/issue_images/0030/4226/image.jpg,"There is a tree limb that has fallen or overgrown the fence and is hanging low, requiring bicyclists and walkers to have to duck underneath. The limb needs to be trimmed back.",2015-03-26T21:30:52-04:00,https://seeclickfix.com/files/issue_images/0030/3341/SCF__20150324_1855111060038476.jpg,"Large tree branch on sidewalk from city tree in front of 321/323 Oakland Ave... Please pickup. 

This tree is a nuisance and the city has done nothing to help. Over the years it has... 

1) TOTALLED my car when a branch fell on it during a wind storm. 

2) Broken my sewer main to the street ($4000)

3) Overgrown so much onto my house that I had to pay someone to trim it because the city wouldn't ($1000)

4) Constantly has branches and leaves falling from it that need to be cleaned up ($20 every 2 weeks to  my teenage neighbor) 

I have not once  seen the city do  anything to  the tree in the 8 years I have lived here... PLEASE MAINTAIN",2015-03-24T22:20:31-04:00,https://seeclickfix.com/files/issue_images/0031/7058/1430066477002.jpg,15 foot branch fell onto sidewalk,2015-04-26T12:41:26-04:00,https://seeclickfix.com/files/issue_images/0018/6941/1396567624891.jpg,2 dead trees ,2014-04-03T19:27:54-04:00,https://seeclickfix.com/files/issue_images/0066/4369/20170106_183413.jpg,overgrown brush is impeding access to walkway,2017-01-07T12:47:49-05:00,https://seeclickfix.com/files/issue_images/0053/1039/1466567887669.jpg,Tree branch fallen on car,2016-06-21T23:59:46-04:00,07/11/2013 11:42:40 AM,37.81591806,-122.25509592
382,https://seeclickfix.com/files/issue_images/0013/9389/1374115823614.jpg,Overgrown and blocking side walk. ,2013-07-17T22:51:11-04:00,,"Our bus operators reported a low hanging tree limb at E24th St. between 8th Ave. and 9th Ave. When traveling southeast on E24th from 8th Ave, the low hanging tree limb is approximately 50 feet from the intersection. Our bus Operators have reported hitting this tree limb when it is dark because they are unable to see it in time. They have informed us that this limb has the potential of damaging the coaches windshield.",2016-05-17T02:00:35-04:00,,Tree fell down last year and was never replaced,2015-08-05T14:18:12-04:00,,Palm tree trimmings encroaching street and sidewalk ,2017-04-15T21:28:33-04:00,,,,,,,07/17/2013 08:02:51 PM,37.80121197,-122.24347242
383,https://seeclickfix.com/files/issue_images/0080/9233/1498852051565.jpg,Street tree branches on top of our property on 1000 90th Ave ,2017-06-30T15:47:37-04:00,https://seeclickfix.com/files/issue_images/0080/9235/1498852051565.jpg,Street tree branches on top of our property on 1000 90th Ave ,2017-06-30T15:49:08-04:00,https://seeclickfix.com/files/issue_images/0080/9237/1498852051565.jpg,Street tree branches on top of our property on 1000 90th Ave ,2017-06-30T15:49:10-04:00,https://seeclickfix.com/files/issue_images/0080/9230/1498851928260.jpg,Fallen tree for a while still here ,2017-06-30T15:45:54-04:00,https://seeclickfix.com/files/issue_images/0080/9236/1498852051565.jpg,Street tree branches on top of our property on 1000 90th Ave ,2017-06-30T15:49:08-04:00,https://seeclickfix.com/files/issue_images/0014/0488/20130717_114741.jpg,tree branch hanging over sidewalk,2013-07-22T15:24:40-04:00,07/22/2013 02:23:11 PM,37.74549921,-122.18167515
